{
  "schema_version": "1.0",
  "county_id": "01",
  "county_name": "Mombasa",
  "period": {
    "start": "2026-01-27",
    "end": "2026-02-02",
    "week_number": 5,
    "year": 2026
  },
  "variables": {
    "temperature": {
      "weekly": {
        "mean": 28.3,
        "max": 32.5,
        "min": 24.1
      },
      "daily": [31.8, 32.2, 32.5, 32.1, 31.5, 30.9, 31.2],
      "daily_min": [24.1, 24.8, 25.2, 24.9, 24.5, 24.3, 24.6],
      "daily_mean": [27.9, 28.5, 28.8, 28.5, 28.0, 27.6, 27.9],
      "units": "°C",
      "anomaly": 1.2
    },
    "rainfall": {
      "weekly": {
        "total": 15.3,
        "max_intensity": 8.2,
        "rainy_days": 3
      },
      "daily": [0.0, 0.0, 8.2, 5.1, 2.0, 0.0, 0.0],
      "units": "mm",
      "probability_above_normal": 35.0
    },
    "wind": {
      "weekly": {
        "mean_speed": 18.7,
        "max_gust": 35.2,
        "dominant_direction": "SE"
      },
      "units": "km/h",
      "daily_peak": [22.3, 25.8, 35.2, 28.5, 24.1, 19.7, 18.3],
      "daily_direction": ["SE", "SE", "E", "SE", "SE", "SE", "S"]
    }
  },
  "wards": [
    {
      "ward_id": "0101",
      "ward_name": "Mvita",
      "rainfall_total": 14.8,
      "temp_max": 32.3,
      "temp_min": 24.5,
      "temp_mean": 28.4,
      "wind_max": 34.2,
      "wind_mean": 18.5,
      "grid_points_used": 6,
      "quality_flag": "good"
    },
    {
      "ward_id": "0102",
      "ward_name": "Likoni",
      "rainfall_total": 16.2,
      "temp_max": 32.8,
      "temp_min": 23.8,
      "temp_mean": 28.3,
      "wind_max": 36.5,
      "wind_mean": 19.2,
      "grid_points_used": 8,
      "quality_flag": "good"
    },
    {
      "ward_id": "0103",
      "ward_name": "Kisauni",
      "rainfall_total": 15.7,
      "temp_max": 31.9,
      "temp_min": 24.8,
      "temp_mean": 28.1,
      "wind_max": 33.8,
      "wind_mean": 18.1,
      "grid_points_used": 7,
      "quality_flag": "good"
    },
    {
      "ward_id": "0104",
      "ward_name": "Nyali",
      "rainfall_total": 14.1,
      "temp_max": 32.1,
      "temp_min": 24.3,
      "temp_mean": 28.2,
      "wind_max": 35.9,
      "wind_mean": 19.0,
      "grid_points_used": 5,
      "quality_flag": "good"
    }
  ],
  "extremes": {
    "highest_rainfall": {
      "ward_id": "0102",
      "ward_name": "Likoni",
      "value": 16.2,
      "days": [2]
    },
    "lowest_rainfall": {
      "ward_id": "0104",
      "ward_name": "Nyali",
      "value": 14.1
    },
    "hottest_ward": {
      "ward_id": "0102",
      "ward_name": "Likoni",
      "value": 32.8,
      "day": 2
    },
    "coolest_ward": {
      "ward_id": "0102",
      "ward_name": "Likoni",
      "value": 23.8,
      "day": 0
    },
    "windiest_ward": {
      "ward_id": "0102",
      "ward_name": "Likoni",
      "value": 36.5
    },
    "flood_risk_wards": []
  },
  "metadata": {
    "data_source": "GFS",
    "model_run": "2026-01-27T00:00:00Z",
    "generated": "2026-01-27T03:20:00Z",
    "aggregation_method": "point-in-polygon",
    "grid_resolution": "0.25°",
    "grid_points_used": 26,
    "warnings": [],
    "system_version": "1.0.0",
    "processing_duration_seconds": 9.8
  },
  "disclaimer": "This forecast is generated from GFS model data and is for planning purposes only. Contact Kenya Meteorological Department for official forecasts and warnings.",
  "quality_flags": {
    "overall_quality": "excellent",
    "missing_data_percent": 0.0,
    "spatial_coverage_percent": 100.0,
    "warnings": []
  }
}
