{
  "schema_version": "1.0",
  "county_id": "23",
  "county_name": "Turkana",
  "period": {
    "start": "2026-01-27",
    "end": "2026-02-02",
    "week_number": 5,
    "year": 2026
  },
  "variables": {
    "temperature": {
      "weekly": {
        "mean": 31.8,
        "max": 38.5,
        "min": 22.3
      },
      "daily": [37.2, 38.1, 38.5, 37.8, 36.9, 36.2, 36.8],
      "daily_min": [22.3, 23.1, 23.8, 23.5, 22.9, 22.5, 22.8],
      "daily_mean": [30.8, 31.6, 32.2, 31.7, 30.9, 30.4, 30.8],
      "units": "°C",
      "anomaly": 2.3
    },
    "rainfall": {
      "weekly": {
        "total": 1.2,
        "max_intensity": 0.8,
        "rainy_days": 2
      },
      "daily": [0.0, 0.0, 0.8, 0.4, 0.0, 0.0, 0.0],
      "units": "mm",
      "probability_above_normal": 20.0
    },
    "wind": {
      "weekly": {
        "mean_speed": 22.5,
        "max_gust": 42.8,
        "dominant_direction": "NE"
      },
      "units": "km/h",
      "daily_peak": [28.5, 32.1, 42.8, 36.2, 31.5, 27.8, 25.9],
      "daily_direction": ["NE", "NE", "E", "NE", "NE", "NE", "N"]
    }
  },
  "wards": [
    {
      "ward_id": "2301",
      "ward_name": "Turkana Central",
      "rainfall_total": 1.0,
      "temp_max": 38.2,
      "temp_min": 22.8,
      "temp_mean": 31.5,
      "wind_max": 41.5,
      "wind_mean": 22.1,
      "grid_points_used": 15,
      "quality_flag": "good"
    },
    {
      "ward_id": "2302",
      "ward_name": "Turkana North",
      "rainfall_total": 0.8,
      "temp_max": 39.1,
      "temp_min": 21.5,
      "temp_mean": 32.3,
      "wind_max": 44.2,
      "wind_mean": 23.5,
      "grid_points_used": 18,
      "quality_flag": "good"
    },
    {
      "ward_id": "2303",
      "ward_name": "Turkana South",
      "rainfall_total": 1.5,
      "temp_max": 37.8,
      "temp_min": 23.1,
      "temp_mean": 31.2,
      "wind_max": 40.8,
      "wind_mean": 21.8,
      "grid_points_used": 16,
      "quality_flag": "good"
    },
    {
      "ward_id": "2304",
      "ward_name": "Loima",
      "rainfall_total": 1.3,
      "temp_max": 38.7,
      "temp_min": 22.0,
      "temp_mean": 31.9,
      "wind_max": 43.5,
      "wind_mean": 22.9,
      "grid_points_used": 14,
      "quality_flag": "good"
    }
  ],
  "extremes": {
    "highest_rainfall": {
      "ward_id": "2303",
      "ward_name": "Turkana South",
      "value": 1.5,
      "days": [2]
    },
    "lowest_rainfall": {
      "ward_id": "2302",
      "ward_name": "Turkana North",
      "value": 0.8
    },
    "hottest_ward": {
      "ward_id": "2302",
      "ward_name": "Turkana North",
      "value": 39.1,
      "day": 2
    },
    "coolest_ward": {
      "ward_id": "2302",
      "ward_name": "Turkana North",
      "value": 21.5,
      "day": 0
    },
    "windiest_ward": {
      "ward_id": "2302",
      "ward_name": "Turkana North",
      "value": 44.2
    },
    "flood_risk_wards": []
  },
  "metadata": {
    "data_source": "GFS",
    "model_run": "2026-01-27T00:00:00Z",
    "generated": "2026-01-27T03:25:00Z",
    "aggregation_method": "point-in-polygon",
    "grid_resolution": "0.25°",
    "grid_points_used": 63,
    "warnings": ["Sparse grid coverage in northern wards due to low population density"],
    "system_version": "1.0.0",
    "processing_duration_seconds": 18.3
  },
  "disclaimer": "This forecast is generated from GFS model data and is for planning purposes only. Contact Kenya Meteorological Department for official forecasts and warnings.",
  "quality_flags": {
    "overall_quality": "good",
    "missing_data_percent": 0.0,
    "spatial_coverage_percent": 95.0,
    "warnings": ["Limited validation data available for arid regions"]
  }
}
