{
  "schema_version": "1.0",
  "county_id": "31",
  "county_name": "Nairobi",
  "period": {
    "start": "2026-01-27",
    "end": "2026-02-02",
    "week_number": 5,
    "year": 2026
  },
  "variables": {
    "temperature": {
      "weekly": {
        "mean": 21.5,
        "max": 26.8,
        "min": 14.2
      },
      "daily": [25.3, 26.1, 26.8, 25.9, 24.7, 23.8, 24.2],
      "daily_min": [14.2, 15.1, 15.8, 15.3, 14.9, 14.5, 14.7],
      "daily_mean": [20.8, 21.6, 22.3, 21.6, 20.8, 20.2, 20.5],
      "units": "°C",
      "anomaly": 0.8
    },
    "rainfall": {
      "weekly": {
        "total": 28.7,
        "max_intensity": 12.5,
        "rainy_days": 4
      },
      "daily": [0.0, 5.2, 12.5, 8.3, 2.7, 0.0, 0.0],
      "units": "mm",
      "probability_above_normal": 45.0
    },
    "wind": {
      "weekly": {
        "mean_speed": 13.5,
        "max_gust": 28.3,
        "dominant_direction": "NE"
      },
      "units": "km/h",
      "daily_peak": [18.2, 21.5, 28.3, 24.1, 19.7, 16.3, 15.8],
      "daily_direction": ["NE", "NE", "E", "NE", "NE", "N", "NE"]
    }
  },
  "wards": [
    {
      "ward_id": "3101",
      "ward_name": "Westlands",
      "rainfall_total": 24.3,
      "temp_max": 26.2,
      "temp_min": 14.8,
      "temp_mean": 21.2,
      "wind_max": 26.5,
      "wind_mean": 12.8,
      "grid_points_used": 8,
      "quality_flag": "good"
    },
    {
      "ward_id": "3102",
      "ward_name": "Kasarani",
      "rainfall_total": 31.5,
      "temp_max": 27.1,
      "temp_min": 14.0,
      "temp_mean": 21.8,
      "wind_max": 28.9,
      "wind_mean": 14.2,
      "grid_points_used": 10,
      "quality_flag": "good"
    },
    {
      "ward_id": "3103",
      "ward_name": "Embakasi",
      "rainfall_total": 29.8,
      "temp_max": 27.5,
      "temp_min": 13.8,
      "temp_mean": 22.1,
      "wind_max": 29.2,
      "wind_mean": 14.5,
      "grid_points_used": 12,
      "quality_flag": "good"
    },
    {
      "ward_id": "3104",
      "ward_name": "Kibera",
      "rainfall_total": 26.1,
      "temp_max": 26.5,
      "temp_min": 14.5,
      "temp_mean": 21.4,
      "wind_max": 25.8,
      "wind_mean": 13.1,
      "grid_points_used": 7,
      "quality_flag": "good"
    },
    {
      "ward_id": "3105",
      "ward_name": "Langata",
      "rainfall_total": 30.2,
      "temp_max": 26.0,
      "temp_min": 13.5,
      "temp_mean": 20.9,
      "wind_max": 27.3,
      "wind_mean": 13.8,
      "grid_points_used": 9,
      "quality_flag": "good"
    }
  ],
  "extremes": {
    "highest_rainfall": {
      "ward_id": "3102",
      "ward_name": "Kasarani",
      "value": 31.5,
      "days": [2, 3]
    },
    "lowest_rainfall": {
      "ward_id": "3101",
      "ward_name": "Westlands",
      "value": 24.3
    },
    "hottest_ward": {
      "ward_id": "3103",
      "ward_name": "Embakasi",
      "value": 27.5,
      "day": 2
    },
    "coolest_ward": {
      "ward_id": "3103",
      "ward_name": "Embakasi",
      "value": 13.8,
      "day": 0
    },
    "windiest_ward": {
      "ward_id": "3103",
      "ward_name": "Embakasi",
      "value": 29.2
    },
    "flood_risk_wards": []
  },
  "metadata": {
    "data_source": "GFS",
    "model_run": "2026-01-27T00:00:00Z",
    "generated": "2026-01-27T03:15:00Z",
    "aggregation_method": "point-in-polygon",
    "grid_resolution": "0.25°",
    "grid_points_used": 46,
    "warnings": [],
    "system_version": "1.0.0",
    "processing_duration_seconds": 12.5
  },
  "disclaimer": "This forecast is generated from GFS model data and is for planning purposes only. Contact Kenya Meteorological Department for official forecasts and warnings.",
  "quality_flags": {
    "overall_quality": "good",
    "missing_data_percent": 0.0,
    "spatial_coverage_percent": 100.0,
    "warnings": []
  }
}
